,speech_text,intent,prediction_non_augmented,prediction_augmented
42,change my alarms to mountain time,alarm_set,alarm_query,alarm_remove
50,please talk softer,audio_volume_down,audio_volume_mute,audio_volume_down
63,turn off media volume,audio_volume_mute,audio_volume_down,audio_volume_mute
66,no notifications for five minutes,audio_volume_mute,alarm_remove,audio_volume_mute
67,turn off the sound,audio_volume_mute,iot_hue_lightoff,audio_volume_mute
72,could you speak a little more softly,audio_volume_up,audio_volume_mute,audio_volume_down
85,when is the school dance junction marked,calendar_query,qa_factoid,recommendation_movies
93,is there anything i need to be aware of,calendar_query,general_explain,alarm_query
94,do i have any undone tasks,calendar_query,lists_query,general_quirky
95,what is left for today,calendar_query,lists_query,calendar_query
102,what day of the week is my birthday this year,calendar_query,datetime_query,calendar_query
105,format the calendar,calendar_remove,calendar_remove,calendar_set
107,delete event from mine,calendar_remove,lists_remove,calendar_remove
115,remove upcoming task,calendar_remove,lists_remove,calendar_remove
129,blot me all the phone calls planned for the morning of twenty three march,calendar_set,calendar_query,calendar_set
130,can you remind me about my meeting tomorrow,calendar_set,calendar_query,calendar_set
133,next week my uncle birthday,calendar_set,calendar_set,calendar_query
149,please cook me a hamburger,cooking_recipe,cooking_recipe,takeaway_order
163,can you please change the time zone to us,datetime_convert,datetime_convert,datetime_query
166,what time will it be locally at nine am bangalore india time,datetime_convert,datetime_query,datetime_convert
168,change mountain standard to pacific,datetime_convert,iot_hue_lightchange,datetime_convert
169,please tell me the date,datetime_query,datetime_query,calendar_query
170,date today,datetime_query,datetime_query,calendar_query
171,what is today,datetime_query,datetime_query,calendar_query
178,which date is on next monday,datetime_query,datetime_query,calendar_query
184,what day of the week does the next holiday fall on,datetime_query,datetime_query,calendar_query
186,can you tell me the date today,datetime_query,datetime_query,calendar_query
198,refresh email,email_query,email_addcontact,email_sendemail
199,i need to know all of the emails from contact pertaining to subject,email_query,email_query,email_querycontact
200,open email,email_query,email_query,email_sendemail
211,carlos linux upgrade email,email_query,email_addcontact,email_sendemail
222,does contact mona has an email as well,email_querycontact,email_query,email_addcontact
226,select the contact,email_querycontact,email_querycontact,email_addcontact
238,send new email to jana dot litt at gmail dot com,email_sendemail,email_addcontact,email_sendemail
243,jj.nzt@yahoo dot com,email_sendemail,email_addcontact,social_post
260,perfect response to command.,general_affirm,general_affirm,general_negate
266,you got the command right.,general_affirm,general_affirm,general_negate
278,i like you cancel.,general_commandstop,calendar_remove,general_commandstop
280,would you cancel it please.,general_commandstop,calendar_remove,general_commandstop
283,olly will you cancel please.,general_commandstop,audio_volume_mute,general_commandstop
288,will you cancel it.,general_commandstop,calendar_remove,general_commandstop
303,did you get what just said correctly?,general_confirm,general_negate,general_explain
304,did you get what said correctly?,general_confirm,general_negate,general_explain
331,your words is not so clear.,general_explain,general_explain,general_negate
340,i didn't get your response.,general_explain,general_explain,general_negate
342,what you said now was not clear.,general_explain,general_explain,general_negate
347,didn't understand what you said now.,general_explain,general_explain,general_negate
381,ah that's nice one.,general_praise,general_praise,general_affirm
398,today i had a lunch with my longtime sweetheart play me a nice song to the mood,general_quirky,music_likeness,play_music
399,what's on tv,general_quirky,recommendation_movies,news_query
400,is the data prefers any problems in objects,general_quirky,qa_factoid,general_quirky
401,your salary,general_quirky,qa_stock,qa_currency
402,overall day,general_quirky,calendar_query,weather_query
413,where did he was yesterday,general_quirky,qa_factoid,email_querycontact
416,give me the product review from gamespot about the nintendo switch,general_quirky,social_post,social_query
423,retry please.,general_repeat,music_settings,general_repeat
448,turn on the roomba,iot_cleaning,iot_wemo_on,iot_cleaning
475,set the mood please,iot_hue_lightchange,play_audiobook,alarm_set
478,make curser adjustable position,iot_hue_lightchange,iot_wemo_off,iot_wemo_on
484,can you set the living room lights to pink,iot_hue_lightchange,iot_hue_lightup,iot_hue_lightchange
486,let's have a warm glow in the front room,iot_hue_lightchange,iot_hue_lightup,iot_hue_lighton
488,change my light color to blue and please turn off the kitchen light,iot_hue_lightchange,iot_hue_lightchange,iot_hue_lightoff
499,light is too much,iot_hue_lightdim,iot_hue_lightdim,iot_hue_lighton
509,power off the current,iot_hue_lightoff,iot_wemo_off,alarm_remove
511,by main power off,iot_hue_lightoff,iot_hue_lightoff,iot_wemo_off
529,can you turn up the lights,iot_hue_lightup,iot_hue_lighton,iot_hue_lightup
556,create a blank list,lists_createoradd,lists_createoradd,lists_remove
573,open google keep,lists_query,email_query,social_query
576,did i put toothpaste on my pick up list,lists_query,lists_createoradd,lists_query
596,please delete what i just typed,lists_remove,lists_remove,social_post
597,take bread out from the shopping list,lists_remove,lists_createoradd,lists_remove
601,get rid of peas,lists_remove,calendar_remove,alarm_remove
614,add song to running list,music_likeness,lists_createoradd,music_likeness
616,add this channel to pandora,music_likeness,social_post,play_radio
618,i like it,music_likeness,general_affirm,music_likeness
625,all i ever want to hear is rap,music_likeness,music_likeness,music_settings
627,please thumbs up this song,music_likeness,music_likeness,music_settings
633,when did pop it like it's hot come out,music_query,cooking_recipe,qa_factoid
638,song info,music_query,music_settings,music_query
639,what list is available for my favorite music from ed sheeran,music_query,play_music,music_query
640,who is this,music_query,email_querycontact,qa_factoid
641,list of playback of ar rahman collections,music_query,play_music,music_query
645,can you locate some gospel music for me,music_query,music_likeness,play_music
647,music traking,music_query,play_music,music_settings
658,what is the seattle city council doing about homelessness,news_query,transport_traffic,recommendation_events
662,please keep tabs on how the presidential debates are going,news_query,news_query,recommendation_events
669,find me info on cars,news_query,transport_query,general_quirky
678,start playing american gods where i last stopped,play_audiobook,play_game,recommendation_movies
679,play from my last session of joes book,play_audiobook,play_audiobook,play_music
683,can you play file,play_audiobook,play_game,play_music
684,audio,play_audiobook,audio_volume_up,music_settings
698,let's play,play_game,play_game,play_music
701,anyone for tennis,play_game,recommendation_events,play_game
704,we should play nfs at high speed,play_game,play_game,play_music
707,bring up papa pear saga,play_game,play_audiobook,play_game
710,paper scissors or stone,play_game,cooking_recipe,qa_definition
713,i would like to hear the theme song to this is us,play_music,music_likeness,play_music
714,play the list from my favorites,play_music,play_music,music_likeness
718,play jumper by third eye blind,play_music,play_audiobook,play_music
720,please turn on my music,play_music,audio_volume_up,play_music
723,play true love next,play_music,play_game,play_music
728,play jingle bells next,play_music,play_music,play_radio
730,play all third day,play_music,calendar_remove,play_music
736,play my play list,play_podcasts,play_podcasts,music_query
744,can you play back to december,play_podcasts,play_game,play_music
746,skip this episode,play_podcasts,calendar_remove,play_podcasts
747,skip this one,play_podcasts,lists_remove,music_settings
750,play radia,play_radio,play_game,play_radio
751,play nine hundred and seventy one,play_radio,play_audiobook,play_music
778,u. s. d. to g. b. p.,qa_currency,qa_stock,datetime_convert
806,what does a grapefruit look like,qa_definition,cooking_recipe,qa_definition
807,what year what the eiffel tower built,qa_factoid,datetime_query,qa_factoid
808,when does the super bowl officially start,qa_factoid,qa_factoid,recommendation_movies
815,when is shakira's birthday,qa_factoid,datetime_query,calendar_query
816,please tell me about the historic facts about india,qa_factoid,qa_factoid,general_quirky
821,calculate distance from boston to new york,qa_factoid,transport_query,datetime_convert
831,convert ten inches to centimeters,qa_maths,datetime_convert,qa_maths
832,what is the answer to this math question,qa_maths,qa_maths,qa_definition
834,how many inches make one feet,qa_maths,qa_factoid,qa_maths
848,what is the value of apple,qa_stock,qa_definition,qa_currency
860,let me see cultural events for this weekend in palermo neighborhood,recommendation_events,general_quirky,recommendation_events
861,what are the concerts happening nearby,recommendation_events,recommendation_movies,recommendation_events
862,is there any type of festival going on in town this weekend,recommendation_events,calendar_query,recommendation_events
863,show me painting exhibition in bay area,recommendation_events,general_quirky,recommendation_events
864,are there any fun things to do in seattle this weekend,recommendation_events,general_quirky,recommendation_events
865,what's going on,recommendation_events,news_query,recommendation_events
870,what do they have going on for festivals downtown,recommendation_events,calendar_query,recommendation_events
871,could you list out the information on book fairs in washington dc for next week,recommendation_events,calendar_query,recommendation_events
873,when is the yearly cultural event coming up,recommendation_events,calendar_query,recommendation_events
877,give me the list of circus shows going on in the city right now,recommendation_events,recommendation_movies,recommendation_events
882,i'm looking for a casual restaurant for a dinner date,recommendation_locations,recommendation_locations,takeaway_order
912,tell comcast i am still on hold,social_post,audio_volume_mute,play_radio
914,post new status,social_post,lists_remove,email_addcontact
957,what takeout places are near me,takeaway_order,takeaway_query,recommendation_locations
963,where can i order pizza for delivery,takeaway_query,takeaway_order,takeaway_query
982,where can i book a train ticket to oregon,transport_query,transport_ticket,transport_query
983,navigation search,transport_query,transport_query,transport_traffic
987,how far away is the nearest rest stop,transport_query,transport_query,recommendation_locations
999,train leaving,transport_query,transport_query,transport_ticket
1036,get me a ride on the commuter train from nj to ny,transport_ticket,transport_taxi,transport_ticket
1038,is it possible to drive now in ohio,transport_traffic,transport_query,transport_traffic
1057,do i have to bring umbrella for tonight party,weather_query,general_quirky,transport_taxi
1058,should i wear gloves tonight,weather_query,iot_cleaning,qa_definition
1063,is summer going on,weather_query,weather_query,recommendation_movies
1064,do you think i can wear sandals or should i wear sneakers tonight at seven pm,weather_query,general_quirky,qa_definition
1068,do i need to wear sunscreen today,weather_query,weather_query,qa_definition
